Nev;Poszter;Jatekkep 1;Jatekkep 2;Leiras;Ertekeles
Minecraft;pic_large_minecraft.jpg;pic_large_minecraft_cover_01.jpg;pic_large_minecraft_cover_02.jpg;A Minecraft egy nyílt világú sandbox játék, amelyben a játékosok építhetnek, felfedezhetnek és túlélhetnek egy véletlenszerűen generált világban. A játék lehetővé teszi az egyéni és többjátékos módokat, különböző játékmódokkal, mint például túlélő, kreatív és hardcore mód.;3
The Witcher 3;pic_large_witcher3.jpg;pic_large_witcher3_cover_01.jpg;pic_large_witcher3_cover_02.jpg;A The Witcher 3: Wild Hunt egy nyílt világú akció-RPG, amelyben Geralt of Rivia történetét követhetjük végig. A játék mély történettel, fejlett harcrendszerrel és hatalmas felfedezhető világgal rendelkezik, tele mellékküldetésekkel és döntésekkel, amelyek befolyásolják a történetet.;5
Grand Theft Auto V;pic_large_gta5.png;pic_large_gta5_cover_01.jpg;pic_large_gta5_cover_02.jpg;A Grand Theft Auto V egy akció-kaland játék, amely három főszereplő történetét meséli el Los Santos városában. A játék nyílt világú játékmenete lehetővé teszi a szabad felfedezést, autózást, küldetések teljesítését és online többjátékos módot is kínál.;5
The Legend of Zelda;pic_large_zelda.jpg;pic_large_zelda_cover_01.jpg;pic_large_zelda_cover_02.jpg;A The Legend of Zelda egy akció-kaland játék, amelyben Link egy hatalmas nyílt világot fedezhet fel, rejtvényeket oldhat meg és ellenségekkel küzdhet. A játék szabadságot kínál a játékosoknak a világ felfedezésében és a történet előrehaladásában.;2
Cyberpunk 2077;pic_large_cyberpunk2077.jpg;pic_large_cyberpunk2077_cover_01.jpg;pic_large_cyberpunk2077_cover_02.jpg;A Cyberpunk 2077 egy futurisztikus nyílt világú RPG, amelyben a játékosok Night City városát fedezhetik fel, különböző küldetéseket teljesíthetnek, és saját karakterük fejlődését irányíthatják egy lebilincselő cyberpunk világban.;4
Dark Souls III;pic_large_darksouls3.jpg;pic_large_darksouls3_cover_01.jpg;pic_large_darksouls3_cover_02.jpg;A Dark Souls III egy akció-RPG, amelyet a nehéz harcrendszeréről és mély lore-járól ismernek. A játék kihívást jelentő ellenségeket és hatalmas bossokat kínál, valamint egy misztikus és sötét fantasy világot.;5